School Name,School ID,School Network
John Spry Elementary Community School,610184,Network 7
Telpochcalli Elementary School,609921,Network 7
Franz Peter Schubert Elementary School,610165,Network 3
John Marshall Metropolitan High School,609723,Network 15
Charles P Steinmetz College Preparatory HS,609732,Network 14
CICS - Avalon/South Shore,400023,Charter
Gwendolyn Brooks College Preparatory Academy HS,609726,Network 17
Hanson Park Elementary School,610068,Network 3
Nathan S Davis Elementary School,609876,Network 8
Wildwood IB World Magnet School,610230,Network 1
Charles P Caldwell Academy of Math & Science ES,609833,ISP
Infinity Math Science and Technology High School,610384,ISP
Scott Joplin Elementary School,609805,Network 11
DeWitt Clinton Elementary School,609859,Network 2
Noble - Rowe-Clark Math and Science Academy,400056,Charter
Louisa May Alcott College Preparatory ES,609774,Network 4
Ombudsman Chicago- Northwest,610569,Options
Lillian R. Nicholson STEM Academy,609793,Network 11
John Harvard Elementary School of Excellence,609971,AUSL
Perkins Bass Elementary School,609791,Network 11
Ferdinand Peck Elementary School,610120,ISP
Noble - Golder College Prep,400053,Charter
Louis A Agassiz Elementary School,609773,ISP
William E B Dubois Elementary School,610364,Network 13
Ombudsman Chicago- West,610571,Options
YCCS-Chatham AcademyHS,400150,Options
Ida B Wells Preparatory Elementary Academy,610110,Network 9
Perspectives - Math and Science Academy,400066,Charter
Lyman A Budlong Elementary School,609817,ISP
Daniel S Wentworth Elementary School,610223,Network 11
James B Farnsworth Elementary School,609912,Network 1
Oliver Wendell Holmes Elementary School,609997,Network 11
Intrinsic Charter School,400162,Charter
Elizabeth H Sutherland Elementary School,610195,Network 10
Camelot Safe HS,610573,Options
Countee Cullen Elementary School,610004,Network 13
Acero Charter Schools - SPC Daniel Zizumbo,400079,Charter
Woodlawn Community Elementary School,609977,Network 9
Dr Jorge Prieto Math and Science,610533,Network 3
Richard Henry Lee Elementary School,610291,ISP
Neal F Simeon Career Academy High School,609692,Network 17
KIPP Ascend Charter School,400044,Charter
Wendell E Green Elementary School,610032,Network 11
Thomas A Edison Regional Gifted Center ES,609794,Network 1
Park Manor Elementary School,610115,Network 12
Pablo Casals Elementary School,610021,AUSL
Acero Charter Schools - Roberto Clemente,400120,Charter
YCCS- Academy of Scholastic Achievement HS,400123,Options
ASPIRA Business and Finance,400172,Charter
Pilsen Elementary Community Academy,610013,Network 7
Acero Charter Schools - Brighton Park,400153,Charter
Pathways in Education- Ashburn,610557,Options
Northwest Middle School,610051,Network 3
Stephen T Mather High School,609724,Network 14
National Teachers Elementary Academy,610231,AUSL
Morton School of Excellence,610257,AUSL
Benito Juarez Community Academy High School,609764,ISP
Louisa May Alcott College Preparatory HS,610524,nan
Oscar DePriest Elementary School,610367,Network 3
Everett McKinley Dirksen Elementary School,609874,Network 1
Ernst Prussing Elementary School,610137,Network 1
Ninos Heroes Elementary Academic Center,609961,Network 12
LaSalle II Magnet Elementary School,610520,ISP
Perspectives - Leadership Academy,400061,Charter
Frank L Gillespie Elementary School,609939,ISP
Horace Greeley Elementary School,609850,Network 4
Parkside Elementary Community Academy,610116,Network 12
Henry D Lloyd Elementary School,610040,ISP
Helen Peirce International Studies ES,610122,ISP
John L Marsh Elementary School,610054,ISP
Calmeca Academy of Fine Arts and Dual Language,610353,Network 8
Manley Career Academy High School,609722,Network 15
George Washington Elementary School,610219,Network 13
Charles Sumner  Math & Science Community Acad ES,610194,Network 5
STEM Magnet Academy,610548,ISP
Thomas Drummond Elementary School,609896,Network 6
Phillip Murray Elementary Language Academy,610090,Network 9
Robert J. Richardson Middle School,610588,Network 10
Edward A Bouchet Math & Science Academy ES,609815,Network 12
Luther Burbank Elementary School,609818,Network 3
Robert Healy Elementary School,609979,Network 6
Ella Flagg Young Elementary School,610235,Network 3
Orr Academy High School,610389,AUSL
Noble - Muchin College Prep,400098,Charter
Alexander Graham Bell Elementary School,609799,Network 4
George B Swift Elementary Specialty School,610196,Network 2
Multicultural Academy of Scholarship,610385,Network 15
Virgil Grissom Elementary School,609944,Network 13
Harold Washington Elementary School,610124,Network 12
Jesse Owens Elementary Community Academy,609943,Network 13
Joseph E Gary Elementary School,609938,Network 7
Daniel Boone Elementary School,609804,Network 2
Marie Sklodowska Curie Metropolitan High School,609756,Network 15
Matthew Gallistel Elementary Language Academy,609935,Network 13
Irma C Ruiz Elementary School,610125,Network 7
CICS - Longwood,400033,Charter
Phoenix Military Academy High School,610304,ISP
Turner-Drew Elementary Language Academy,609895,ISP
Christopher House Charter School,400159,Charter
Langston Hughes Elementary School,610368,Network 13
James Weldon Johnson Elementary School,610274,AUSL
Andrew Jackson Elementary Language Academy,610060,Network 6
Fort Dearborn Elementary School,609924,Network 11
The Montessori School of Englewood Charter,400116,Charter
Sarah E. Goode STEM Academy,610558,Network 16
William C Reavis Math & Science Specialty ES,610143,Network 9
Chicago Math and Science Academy Charter School,400035,Charter
Orville T Bright Elementary School,609811,Network 13
Charles W Earle Elementary School,609897,Network 11
John J Pershing Elementary Humanities Magnet,610126,Network 9
Spencer Technology Academy,610183,Network 3
Acero Charter Schools - Esmeralda Santiago,400114,Charter
Ogden International High School,610529,nan
ASPIRA Charter School - Haugan Middle School,400017,Charter
Washington D Smyser Elementary School,610179,ISP
James Ward Elementary School,610217,ISP
Joshua D Kershaw Elementary School,610019,Network 11
Orozco Fine Arts & Sciences Elementary School,610329,Network 7
Thomas J Waters Elementary School,610220,Network 2
Gerald Delgado Kanoon Elementary Magnet School,609920,Network 7
Camelot Safe Elementary,610572,nan
Thomas Hoyne Elementary School,610002,Network 12
Ellen Mitchell Elementary School,610073,Network 5
Clara Barton Elementary School,609790,Network 11
Acero Charter Schools - Bartolomé de las Casas,400081,Charter
North Lawndale College Prep - Collins,400059,Charter
Joseph Jungman Elementary School,610015,ISP
Kate S Kellogg Elementary School,610016,Network 10
Richard J Daley Elementary Academy,610239,Network 8
Oscar Mayer Magnet School,610059,Network 4
Eli Whitney Elementary School,610227,Network 7
Christian Ebinger Elementary School,609899,ISP
John T Pirie Fine Arts & Academic Center ES,610130,Network 12
West Ridge Elementary School,610542,ISP
Arthur R Ashe Elementary School,610268,Network 12
William W Carter Elementary School,609844,AUSL
Emiliano Zapata Elementary Academy,609973,ISP
John Charles Haines Elementary School,609959,Network 6
Claremont Academy Elementary School,610347,Network 10
Edison Park Elementary School,610523,Network 1
Air Force Academy High School,610513,Network 16
Marvin Camras Elementary School,610539,ISP
Josiah Pickard Elementary School,610129,ISP
Edgar Allan Poe Elementary Classical School,610132,Network 13
Jensen Elementary Scholastic Academy,610271,Network 5
William J Onahan Elementary School,610104,Network 1
Crown Community Academy of Fine Arts Center ES,609873,Network 5
Little Village Elementary School,609834,ISP
John Fiske Elementary School,609919,Network 9
Belmont-Cragin Elementary School,609922,ISP
Collins Academy High School,610499,AUSL
Augustus H Burley Elementary School,609820,ISP
Walter Payton College Preparatory High School,609680,ISP
Urban Prep Academy for Young Men - Bronzeville,400105,nan
Christopher Columbus Elementary School,609863,ISP
